{
  "schemaVersion": "1.0.0",
  "kind": "ToolAdmission",
  "admissionId": "admit-tool.supply-transit-read.v1",
  "toolId": "supply-transit-read",
  "assayId": "assay.supply-transit-read.v1",
  "state": "admitted-read",
  "admittedAt": "2026-08-21T00:10:00Z",
  "expiresAt": "2027-08-21T00:00:00Z",
  "assessor": "tool-assessor-fixture",
  "reviewer": "independent-reviewer-fixture",
  "notes": "Ephemeral coarse-location fixture. Exact address must not be retained."
}
